Number;Name;Text Content;Document;Codes;Number of Codes;Comment;Location;Creator;Creation Date;Modifier;Modification Date
18:250;Probably my assessment of the risk factors was one of the main factors which influ- enced my decisio…;Probably my assessment of the risk factors was one of the main factors which influ- enced my decision (001).I'd say the assessment of the risk factors involved was probably my main priority (002).However, eight of the ten novices assessed the neglect to the children as being relatively minor, or not as serious as sexual or physical abuse.I think that [risk] was very important in my decision. I'd suppose I'd made judgements about the resources for the mother, or the lack of these. And I've also made judge- ments about if they were there, the mother may be motivated to look after the kids. So I suppose that had a big bearing on not removing the children and the lack of seriousness in the sense that they weren't being left out in the cold all night (009). This is a problem of neglect... I'm not saying that it's not significant but the immedi- ate safety of the children is not jeopardised (007).I am not quite sure [if I would remove the children]. I guess the children are suffering more from neglect than anything . . . . The mother's not physically hurting them. It's more of a neglect situation (004).Statements such as this can be contrasted with those made by the experts in the study. The expert social workers were more likely to have a clearer understanding and knowledge of risk assessment and those factors most important in determining risk to the child. They were also more able to weigh up the risks to the children in the case study which led them to conclude that the situation was relatively serious.Yes, I identified lots of risk factors. The children's health problems, the diagnosis of pneumonia, the older children doing the parenting of the younger children, the mother being withdrawn, the older one seeming to choose not to go home after school, the mother's isolation, the fact that the mother doesn't seem to be a very powerful person, she's ended up without too many resources... . That, together with the children's presentation. What's most worrying is that she's not attending to quite a severe health problem, not thinking about what the children need. These risk factors were very important in influencing my decision. It makes it more urgent. It makes it easier to know that there is something that needs to be insisted on. (014)PROCEDURAL KNOWLEDGE—LEGISLATIONGenerally, novices reported that they knew very little about the legislation, apart from the basic philosophy underpinning the legislation, and 80 per cent stated that they knew very little about the evidence requirements for court. Therefore, novices did not take the legislation or the evidence requirements for court into account when making their decision. This was largely due to the fact that they felt that they did not have sufficient experience with court;Drury-Hudson - 1999 - Decision making in Child Protection The Use of Theoretical, Empirical and Procedural Knowledge by Novices and Expe.pdf;Structure: Findings Results;1;;start=23 end=2798 startpage=11 endpage=11;Stefan Kleipoedszus;11/10/2018;Stefan Kleipoedszus;11/10/2018
18:251;processes and found the legislation difficult to understand. This is highlighted in the following co…;processes and found the legislation difficult to understand. This is highlighted in the following comments.When you arc reading stuff about the legislation and people writing articles on that, it goes straight over your head because it's boring and you're not taking it in anyway (001).Legislation is often not user friendly and needs to have a handbook on how to interpret it (002).The legislative context defines the terms and conditions under which a child is considered to be in need of care and protection and outlines the authority under which child protection workers operate. It is therefore difficult to see how any reasonable decision can be arrived at without an understanding of the legislative framework. It is concerning that the majority of students enter child protection placements with very little understanding of the legal context they are operating within and they are only too happy to rely on co-workers to supply them with the information they need. This presupposes that all practising child protection workers possess a good understanding of the legis- lative framework, which is often not the case. Furthermore, it places students in a vulnerable and dependent role throughout the course of their placement, which does little to foster professional self-reliance and competence.This is a situation which should be remedied. Students need to be provided with at least a rudimentary understanding of the Children's Protection Act under which they work, prior to undertaking a placement in this area.While novices did not generally know a great deal about the legislation or the evidence requirements for court, the majority of them (80 per cent) stated that they felt that it was really important for people working in the area of child protection to have a good knowledge of the legislation:Well you need to very clearly know your limits from a legal point of view. You need to be very clear about what you can do and what you cannot do especially when you are considering removing children (003).In comparison, experts were much more aware of the principles, philosophy, investigative orders and powers that were a feature of the legislation and all (100 per cent) stated that they were very familiar with the evidence require- ments for court. Many experts spoke of having to give evidence in court or of writing reports for court.I know a lot about the evidence requirements because we see probably the most seriously injured children and so a lot of the children who I am involved with do end up in court cases. And it's not just the Youth Court but the Family Court and the Criminal Court as well. I spend a lot of time writing court reports and giving evidence in court (010).I think the evidence for court needs to be detailed and it needs to indicate quite clearly that the children's needs aren't being met and that the children's needs are unlikely to be met either (015).;Drury-Hudson - 1999 - Decision making in Child Protection The Use of Theoretical, Empirical and Procedural Knowledge by Novices and Expe.pdf;Structure: Findings Results;1;;start=40 end=2957 startpage=12 endpage=12;Stefan Kleipoedszus;11/10/2018;Stefan Kleipoedszus;11/10/2018
18:252;While experts generally considered that they had a good knowledge of child protection legislation an…;While experts generally considered that they had a good knowledge of child protection legislation and this exerted a conscious influence over their decision making, some experts also emphasized that this was not the primary influence in their final decision but their final decision was based on their own assessment of what needed to happen.I probably know quite a bit about the evidence requirements for court. That wouldn't have had much impact on my decision as it doesn't seem to me that we are at that point. We are not trying to prove a crime . . . we are not trying to get anyone to make a statement. You're miles away from a situation where you are seeking long-term guardianship and you're probably not even seeking a short-term order (012).I would say that I'm very up to date with the evidence requirements for court and, yes, it did have an impact on my decision because I knew that I would have to put up a very strong case to the court to get the children removed. However, it wouldn't mean to say that I wouldn't take that decision (017).PROCEDURAL KNOWLEDGE—ORGANIZA TIONAL POLICY AND PROCEDURESA tension frequently exists between professional autonomy and the environ- ment within which practice takes place. Research on professionals in organ- izations indicates discrepancies between professional and organizational expectations and goals (Dworkin, 1990). These goals are developed within the context of community expectations and organizational policy. Therefore, what in the professional's view may be in the best interests of the child is not the only factor influencing child protection decision making as workers are also bound by organizational policies and procedures. It is therefore important for child protection workers to have a good understanding of these forms of knowledge.Novices often felt very unclear about the definitions and differences between policy and procedures and often confused these with legislation. They also often found policies and procedures difficult to understand and were very reliant on their supervisor to inform them of any which existed and how these should be taken into account The following excerpts are fairly typical statements made by novices in relation to policies and procedures:I am not quite sure of the differences between policy and procedure (005).I didn't take them into account when I was forming my decision. I did take into account the practice papers on risk assessment but there would obviously be some other practice papers I could draw upon. But mostly the procedure would be known and is fairly well used in FACS [Family and Community Services]. But just the practice papers on risk assessment. It is conscious in that it's very present at the moment. It is conscious (006).I suppose I would draw on child protection policy if it is a policy. I'm not sure what;Drury-Hudson - 1999 - Decision making in Child Protection The Use of Theoretical, Empirical and Procedural Knowledge by Novices and Expe.pdf;Structure: Findings Results;1;;start=23 end=2876 startpage=13 endpage=13;Stefan Kleipoedszus;11/10/2018;Stefan Kleipoedszus;11/10/2018
20:128;Sample Demographic Characteristics The sample’s descriptive information is presented in Table 1. Ove…;"Sample Demographic CharacteristicsThe sample’s descriptive information is presented in Table 1. Over half of the sample (58.7%) was African American and one in four (25.6%) were White. The sample was evenly split between males (49.6%) and females (50.4%).Prevalence of Placement in Foster CareRoughly one in ten children (105 total) were placed into foster care during the follow-up period. The mean age of placement was slightly more than eight years old. Of those children who were placed, 29.5% (n = 31) were first placed at age 4 or 5, 27.6% (n=29) at age 6 or 7, 22.9% (n=24) at ages 8–11, 15.2% (n=16) at ages 12–15, and 4.8% (n=5) at age 16 or 17.Bivariate Within-Domain Multivariate Predictors of Foster Care EntryThe bivariate and within-domain predictors of entry into foster care are presented in the first two columns of Table 2. Among the child characteristics, there were no significant bivariate effects of demographic characteristics, behavioral prob- lems, or low birth weight/prematurity. Only Battelle Developmental Screening Test scores predicted foster care entry, with lower scores predicting higher risk of foster entry. Within-domain multivariate analyses produced similar findings (only lower Battelle scores predicted foster care entry). Although African American children were significantly less likely than white children to enter foster care, there was no significant overall effect of race/ethnicity.Among caregiver characteristics, there were no significant bivariate or multivariate effects of physical health, adult history of victimization, or parenting attitudes. There were significant bivariate effects of both childhood physical victimization and childhood sexual victimization, although these were no longer significant in within-domain multivariate analyses. Significant bivariate effects of both alcohol use and depression symptoms persisted in within-domain multivariate analyses; caregivers with more alcohol use and with more depressive symptoms were more likely to have their children enter foster care.Among the family microsystem variables examined, none predicted entry into foster care in the bivariate analyses. The same was true of the multivariate analyses within the family microsystem class of variables. This could be due in part to the relatively small sample size.Among the macrosystem variables examined, there was no significant effect of neighborhood satisfaction. However, both low social support and caregiver’s receipt of mental health services predicted foster care entry. Both of these variables remained significant in the multivariate analysis within macrosystem.Finally, children’s early maltreatment experiences were examined. In bivariate analyses, children who had past reports of neglect, physical abuse, and emotional maltreatment were at elevated risk for entry into foster care. In addition, more severe experiences of maltreatment were associated with risk for entry into foster care, as were number of reports. There was no significant effect of early reports of sexual abuse. In the multivariate analysis within early maltreatment, only emotional maltreatment and number of early CPS reports significantly predicted entry into foster care.Omnibus Multivariate Predictors of Entry into Foster CareAll of the variables that were significant in the domain multivariate analyses were entered into an omnibus Cox survival regression: child Battelle Developmental Screening Test, caregiver alcohol use, caregiver depressive symptoms, caregiver mental health care, early emotional maltreatment, and number of early reports of maltreatment. This analysis is presented in";English, Thompson, White - 2015 - Predicting risk of entry into foster care from early childhood experiences A survival analysis using L.pdf;Structure: Findings Results;1;;start=1557 end=5208 startpage=4 endpage=4;Stefan Kleipoedszus;11/10/2018;Stefan Kleipoedszus;11/10/2018
21:331;The effects of heuristics on the subjective risk assessment We hypothesised that the objective level…;"The effects of heuristics on the subjective risk assessmentWe hypothesised that the objective level of risk would significantly influence the risk level evaluated by the respondents (subjective risk assessment). Indeed, the highest average of subjective risk assessment was for the high-risk group (M1 1⁄4 3.95; SD1 1⁄4 0.98), followed by the averages of the ambiguous- risk cases (M2 1⁄4 2.75; SD2 1⁄4 1.13), and finally the no-risk cases (M3 1⁄4 0.54; SD3 1⁄4 0.639). The differences between each pair of averages were significant (high-risk–ambiguous-risk: t 1⁄4 13.18, p , 0.001; ambiguous-risk–no-risk: t 1⁄4 26.36, p , 0.001).Furthermore, in comparing the assessment variances for each risk level, we found the highest for ambiguous risk, followed in descending degree of vari- ance by high-risk and no-risk. Levine’s test of difference between variances indicates that the differences are significant: ambiguous-risk–high-risk, F(422, 210) 1⁄4 1.34, p , 0.01; ambiguous-risk–no-risk, F(422, 211) 1⁄4 3.13, p , 0.001; high-risk – no-risk, F(210, 211) 1⁄4 2.34, p , 0.001. These findings imply that, particularly in the ambiguous cases, other factors such as heuristic thinking may influence the social workers’ professional judgement.To estimate the effects of heuristics (the child’s SES and ethnic origin) on the respondents’ subjective risk assessment, which we controlled for inter- vening effects of professional and personal characteristics, we conducted multiple regression models with subjective risk assessment as the dependent variable; three regression models were estimated, one for each level of ob- jective risk. The results presented in Table 1 indicate that being poor is per- ceived as a serious risk factor for children, even in no-risk cases, and the effect increases as the level of objective risk increases. Ethnicity was a signifi- cant factor only in cases of ambiguous risk, when social workers are faced with uncertainty.The effects of heuristics on social workers’ recommendations for out-of-home placementsNo out-of-home placement recommendations were made for the no-risk cases; 12 per cent of the ambiguous-risk cases and, interestingly, 56 per cent of the high-risk cases were recommended for out-of-home placement. The differences between the three risk levels were significant (x2(2) 1⁄4 245.62; p , 0.001). As hypothesised, we found that as the objective level of risk to the child increases, out-of-home placement is more likely to be recom- mended. We then hypothesised that the respondents’ heuristics influenced";Enosh, Bayer-Topilsky - 2015 - Reasoning and bias Heuristics in safety assessment and placement decisions for children at risk.pdf;Structure: Findings Results;1;;start=255 end=2814 startpage=7 endpage=7;Stefan Kleipoedszus;11/10/2018;Stefan Kleipoedszus;11/10/2018
21:332;their decision for out-of-home placements in ambiguous objective risk cases and, conversely, in case…;"their decision for out-of-home placements in ambiguous objective risk cases and, conversely, in cases of unambiguous risk level, the respondents’ heuristic thinking had little or no impact on their professional decision. To test this hy- pothesis, we performed a chi-square test for each heuristic (SES and ethnic origin) at the high-risk and ambiguous-risk levels.Since none of the low-risk cases was recommended for out-of-home place- ment, there was no need for further analysis at this level. The findings sum- marised in Table 2 show that the recommendations for out-of-home placements in ambiguous-risk cases are significantly higher in low-SES cases compared with moderate-high-SES cases (20.4 per cent versus 3.3 per cent; p , 0.001, respectively) and for children of Mizrahi ethnic origin com- pared with those of Ashkenazy ethnic origin (15.1 per cent versus 8.5 per cent, p , 0.05, respectively). However, to our surprise, we found that the social workers also recommended more out-of-home placements for high-risk, low-SES cases compared with high-risk, moderate-high-SES cases (86.67 per cent versus 26.42 per cent, p , 0.001, respectively). The findings also revealed a trend for more out-of-home placement recommendations for Mizrahi children at high risk compared with Ashkenazy children at high risk (53.4 per cent versus 59.3 per cent, respectively). This difference was not statistically significant.To examine the effects of biases on the likelihood to recommend an out-of-home placement, we conducted a logistic regression analysis for each of the two objective risk levels—ambiguous and high. These results are presented in Table 3.Table 3 demonstrates that, for ambiguous-risk levels, the child’s SES and ethnic origin predict the social worker’s recommendation for an out-of-home placement: children from low-SES families at ambiguous risk are about 2.5 times more likely to be removed than children who are at the same risk level but from moderate-high-SES families. Children at ambiguous risk";Enosh, Bayer-Topilsky - 2015 - Reasoning and bias Heuristics in safety assessment and placement decisions for children at risk.pdf;Structure: Findings Results;1;;start=789 end=2810 startpage=8 endpage=8;Stefan Kleipoedszus;11/10/2018;Stefan Kleipoedszus;11/10/2018
21:333;from Mizrahi origin are twice (OR 1⁄4 2.05) as likely to be removed from their home than Ashkenazy c…;from Mizrahi origin are twice (OR 1⁄4 2.05) as likely to be removed from their home than Ashkenazy children at the same level of risk.Our analyses show that, in high-risk cases, the child’s ethnic origin does not predict the social worker’s recommendation for out-of-home placement. However, the findings demonstrate that, in high-risk cases, SES appears as a strong predictor of the social worker’s likeliness to recommend out-of-home placement: low-SES families are 6.3 times more likely to be removed from their home than children at high risk from moderate-high-SES families. This surprising finding suggests that low SES is perceived by social workers as a risk factor and contradicts the hypothesis that, in cases of unam- biguous risk (no-risk/high-risk), SES will have low or no effect on the social worker’s decision making.;Enosh, Bayer-Topilsky - 2015 - Reasoning and bias Heuristics in safety assessment and placement decisions for children at risk.pdf;Structure: Findings Results;1;;start=0 end=834 startpage=10 endpage=10;Stefan Kleipoedszus;11/10/2018;Stefan Kleipoedszus;11/10/2018
23:230;Descriptive Statistics Approximately 25% of cases were substantiated, and of those, about 24% result…;Descriptive StatisticsApproximately 25% of cases were substantiated, and of those, about 24% resulted in removal. A description of the sample by substantiation and removal can be found in Table 1. Compared with unsubstantiated cases, substantiated cases came from agencies with longer timelines for completing investigations and higher service availability. Substantiated cases were also more likely to come from agencies that lacked a system of care in the area, that were operating under a consent decree and used more standardized assessment tools. On the county level, substantiated cases were more likely than unsubstantiated cases to be from communities with more black residents. Substantiated cases were also more likely to have been investi- gated by caseworkers with an advanced degree and more years of experience. On the family and child level, all risk factors except CPS history and economic problems were more common in substantiated cases than in unsubstantiated cases. Child demographics did not differ by substantiation status.Substantiated cases resulting in removal were more likely to come from agencies allowing 30 or fewer days to complete an investigation and 3 or more days between removal and initial hearing. They were also more likely to come from agencies that lost funding and used a structural decision making model. Removal cases were marginally less likely to have been investigated by a caseworker with a social work degree or an advanced degree. The only family risk factor positively associated with removal was caregiver mental health and substance abuse problems. Additionally, removal cases were more likely than non-removal cases to involve black children or younger children, and less likely to involve non-Hispanic children of a race other than white or black.HLM ResultsResults of our HLM estimates predicting substantiation are found in Table 2. We find no statistically significant asso- ciations between time factors and substantiation. However, for service availability, we find that two factors, collaboration and ability to provide services for unsubstantiated cases, are associated with a significantly lower probability of substan- tiation, even after controlling for county, family and child characteristics. These factors predict a 16 (collaboration) and 20 (services for unsubstantiated cases) percentage point (PP) lower probability of substantiation. For decision-making fac- tors, we find that use of a structural decision-making model predicts a large decrease in the probability of substantiation,;Font, Maguire-Jack - 2015 - Reprint of Decision-making in child protective services Influences at multiple levels of the social ecology.pdf;Structure: Findings Results;1;;start=3030 end=5590 startpage=5 endpage=5;Stefan Kleipoedszus;11/10/2018;Stefan Kleipoedszus;11/10/2018
