Number;Name;Text Content;Document;Codes;Number of Codes;Comment;Location;Creator;Creation Date;Modifier;Modification Date
37:221;of Health and Children, 1999, p. 31). It is, therefore, not surprising when responding to questions…;"of Health and Children, 1999, p. 31). It is, therefore, not surprising when responding to questions about their interpretation of child neglect that 75 per cent of respondents (n = 292) considered that decisions about possible neglect should centre on the impact of the neglectful act on the child. In addition, 75 per cent of respondents (n = 292) agreed with Gibbons et al. (1995) that a high-criticism, low-warmth environment is damaging to a child and 84 per cent (n = 327) agreed with Iwaniec and McSherry (2002) that a physically neglected child is also likely to be experiencing emotional neglect.However, despite respondents recognizing that neglect can affect the health and development of a child, they appeared to differentiate between the various developmental needs of children, giving some needs greater priority than oth- ers. For example, the respondents were asked, in the questionnaire, to indicate whether they agreed or disagreed with the statement that the essential aspects of parenting are to provide merely for a child’s physical and safety needs. Forty-five per cent (n = 175) agreed, while 43 per cent (n = 168) disagreed. In addition, in prioritizing factors of concern in the chronic neglect case scenario, 135 responses focused on lack of supervision and physical harm, while only six respondents considered lack of stimulation and nine poor nurturing. A prioriti- zation on physical and safety needs can lead to the other needs of the child becoming marginalized and conflicts with the findings described above that indicated that respondents recognized what was damaging for a child. This emphasis in practice on physical needs and health and safety issues may reflect the incident-driven system which has dominated child welfare practice for over twenty years in both England and Ireland (Buckley et al., 1997; Jordan and Jor- dan, 2000; Parton et al., 1997). Practitioners working within these systems may find it is easier to identify and refer neglect by focusing on a specific incident or providing tangible evidence of physical neglect or safety issues rather than gathering evidence about the impact of neglect on the socio-emotional development of the child.The knowledge and practical wisdom used by professionals to make judge- ments about referral were also explored. The respondents in the focus groups highlighted the importance of evidence-based decision making. Yet the empha- sis among respondents in the focus groups and amongst respondents comment- ing on the case scenarios in the questionnaire was on gathering facts and information about the particular child and family rather than using research and developmental theories that could inform understanding of the informa- tion gathered. Seventy-six per cent of respondents to the questionnaire (n = 296) believed that decisions regarding child neglect were made based on professional practice experience. However, as discussed below, the respond- ents had limited experience of referring neglect, which raises questions as to what and whose experience was being utilized. Further, respondents to the questionnaire were asked whether they agreed with the statement that ‘deci- sions are made using gut feeling or intuition’. All eleven of the clinical psychol- ogists agreed with this statement, while only twenty-three (40 per cent) of the educational professionals and twenty-two (40 per cent) of the public health";Horwath - 2007 - The Missing Assessment Domain Personal, Professional and Organizational Factors Influencing Professional Judgements whe.pdf;Structure: Findings Results;1;;start=0 end=3419 startpage=6 endpage=6;Stefan Kleipoedszus;12/10/2018;Stefan Kleipoedszus;12/10/2018
37:222;nurses agreed with it. The concept of ‘gut feeling’ was explored further in the focus groups. A them…;"nurses agreed with it. The concept of ‘gut feeling’ was explored further in the focus groups. A theme emerged of gut feeling being considered a hunch and a sense that things were not quite right, with the majority of respondents being clear that ‘intuition is not sufficient’ when making judgements.Referral practice: interpretation of roleThe respondents to the questionnaire were asked to identify their role in terms of referring child neglect. Whilst over 90 per cent (n = 351) confirmed they had a role, thirty-seven respondents (9 per cent) stated that they did not have a referral role. These thirty-seven respondents consisted of drug and mental heath workers (n = 9) and child psychiatrists (n = 6), although some teaching staff did not con- sider referral to be part of their role. This lack of understanding of the referral role amongst these professional groups has been noted elsewhere (see, e.g. Abrahams et al., 1992; Baginsky, 2000; Falkov, 1996; Harbin and Murphy, 2000).Of the 90 per cent who did consider that they had a role in referring child neglect, the majority often completed detailed assessments of the child, the family and their situation before making a decision whether to refer a case to social work services. When asked about the types of pre-referral assessments they completed, respondents indicated that they used a variety of assessment tools, such as direct observation and taking a family history. In addition, they gathered information from within their agency and occasionally contacted other professionals.The findings indicated that there was a lack of consistency amongst respond- ents in their response to the operational threshold for making a referral. Inter- estingly, responses to case scenarios included in the questionnaire indicated variations not only between members of different professional groups, but also amongst members of the same profession. However, more common profes- sional trends were noted in responses to profession-specific group discussions of case scenarios of possible neglect. For example, pre-school and education professionals were least likely to refer immediately to the social work teams, while practitioners working with adults, hospital staff and the Garda Siochána (police) were most likely to refer immediately. The public health nurses gave more mixed responses. One explanation for these differences could be that the respondents to the questionnaire completed the questionnaire individually and relied on their own values and beliefs to inform their practice, whilst the focus group members discussed each scenario in small groups and were influenced by the values and beliefs of their peers. (The influence of peers and teams on referring practice is discussed in detail below.)Feelings and anxieties and the influence on referral practiceWoodhouse and Pengelly (1991) noted, in their study of collaboration between practitioners in the helping professions, that the nature of the task engenders";Horwath - 2007 - The Missing Assessment Domain Personal, Professional and Organizational Factors Influencing Professional Judgements whe.pdf;Structure: Findings Results;1;;start=17 end=3006 startpage=7 endpage=7;Stefan Kleipoedszus;12/10/2018;Stefan Kleipoedszus;12/10/2018
37:223;anxieties and feelings amongst practitioners that influence practice. More specifically, Pollak and…;anxieties and feelings amongst practitioners that influence practice. More specifically, Pollak and Levy (1989) found that feelings such as fear, guilt, shame, anger, control and sympathy might negatively influence professionals’ decisions to refer or act on their child protection concerns. These feelings were present amongst the respondents in the neglect study and appeared to influ- ence referral practice. For example, fear of aggression was identified by ninety respondents (23 per cent) as influencing their decisions to report neglect. These respondents noted that the presence of a physically aggressive carer could lead to standards of care being tolerated that would not normally be accepted where there were less aggressive carers. Respondents in all the focus groups expressed fear and anxiety about both verbal and physical aggression from families towards themselves and their own families. Indeed, several members of the focus groups gave examples of being physically or verbally intimidated or actually attacked following a referral, which had impacted on their professional and personal lives. Stanley and Goddard (2002) believe that fear of actual or perceived aggression may result in feelings of helplessness, acts of defensive practice and reality distortion which could leave children in vulnerable situations.Another type of fear found amongst the respondents was fear associated with making the wrong decision. For example, the GPs in their focus group described fear of litigation from carers if they referred unnecessarily. This fear was associated with concerns about a lack of skill and uncertainty with regard to identifying child neglect. They recognized that diagnosis in cases of children in need was not as certain as in many clinical situations (Bannon et al., 2003). Other professionals, notably the Garda Siochána (police) and professionals from adult services, referred to ‘watching their back’ and routinely making referrals, being fearful about not reporting a concern that could lead to the death of a child.Feelings of guilt and shame were also found to influence referral practice. These centre, according to Pollak and Levy (1989), on professionals wishing to be perceived by service users as trusting and supportive. They consequently felt guilty if they considered they were breaching client confidentiality by referring cases. These feelings were strong amongst community-based workers such as drug outreach workers, who considered trust between themselves and mem- bers of the community to be crucial.The third influence is feelings of anger and control. For example, respondents, notably education professionals, were frustrated and angry by the perceived lack of response to referrals from social work services. They also considered they had no control over the situation once a family was referred to social work services. As one respondent put it, ‘the family have entered a black hole’.Finally, feelings of sympathy for families or fears of appearing oppressive seemed to influence referral practice, with professionals making excuses for parenting behaviours to avoid making a referral. This was most evident in dis- cussions amongst focus group members with regard to distinguishing between neglect and social deprivation. The respondents were anxious and reluctant to make judgements about poverty and parenting when they believed, in a similarThe Missing Assessment Domain 1293;Horwath - 2007 - The Missing Assessment Domain Personal, Professional and Organizational Factors Influencing Professional Judgements whe.pdf;Structure: Findings Results;1;;start=0 end=3441 startpage=8 endpage=8;Stefan Kleipoedszus;12/10/2018;Stefan Kleipoedszus;12/10/2018
37:224;situation, they themselves would struggle to meet the needs of the child. Man- aging this may be eas…;"situation, they themselves would struggle to meet the needs of the child. Man- aging this may be easier if more jurisdictions follow many American states and make a distinction between neglect, which is within the carer’s control, and deprivation that is beyond their control (National Clearing House on Child Abuse and Neglect, no date).From the outside looking in: perceptions of social work practiceWhilst 20 per cent of the respondents (n = 78) to the questionnaire stated that nothing prevented them referring suspected cases of child neglect to the social work teams, a theme of the focus group discussions was that some professionals regarded making a referral to social workers as a formality and did not expect the referral would result in a positive outcome for the child and family. It would appear that these professionals were, as described above, referring out of a sense of fear or obligation, or, as one disability social worker put it:Nothing stops me making a referral but there is a feeling that nothing will happen and won’t be followed up unless in a crisis situation.A minority of professionals, notably public health nurses, described very posit- ive experiences of referring cases of child neglect to social work services. How- ever, the majority of the respondents described more negative experiences. This is significant, bearing in mind that 40 per cent of respondents (n = 156) indicated that their decisions to refer cases were influenced by previous responses from social workers. However, 52 per cent of respondents (n = 203) had not made a referral of child neglect in the last year and 18 per cent (n = 17) had made only one referral. It would seem, therefore, that the majority of respondents’ attitudes towards social work services were not based on ongoing experience. This raises questions about the basis for their opinions. It could be that they were based on experiences of making other types of referral or on the experiences of colleagues. Alternatively, it could be hearsay or myths, rather than reality, that were influencing perceptions.Irrespective of the basis for the opinions, the following four issues emerged from the study which appeared to negatively influence referral to statutory social work services.Lack of communication and feedbackLack of communication from social workers following a referral leaves profes- sionals feeling ineffectual, powerless and uncertain as to what is happening to a child (Cleaver et al., 2004; Ferguson and O’Reilly, 2001; Holland, 2004). Twenty-two per cent of respondents (n = 86) to the questionnaire in this study stated that better communication with social workers following referral would improve referral practice, whilst a further 10 per cent (n = 39) indicated that";Horwath - 2007 - The Missing Assessment Domain Personal, Professional and Organizational Factors Influencing Professional Judgements whe.pdf;Structure: Findings Results;1;;start=17 end=2785 startpage=9 endpage=9;Stefan Kleipoedszus;12/10/2018;Stefan Kleipoedszus;12/10/2018
37:225;poor communication and feedback negatively influenced their referral practice. A hospital profession…;"poor communication and feedback negatively influenced their referralpractice. A hospital professional summarized the problem:... lack of communication, not enough liaison ... slow, poor follow up.The respondents in the focus groups described their anxiety about being left to work with a child and family unsure of what, if anything, was happening with regard to the referral. As the hospital professional quoted above went on to describe, this left her feeling frustrated, angry and unsupported. The focus group respondents indicated that they often did not know what procedures were followed once a referral had been made to social work services. They also described a lack of knowledge about who was actually taking the referral. In some cases, they believed they had been speaking to a receptionist, in other cases a trained duty worker. As Burton (1996) found in her study of GPs’ refer- ral practice, this lack of information about the person taking the referral can act as a barrier to referral. She noted that some respondents in her small-scale study were reluctant to discuss case detail without knowing about the qualifica- tions and experience of the person taking the referral.Poor staff continuityEffective communication is likely to occur if professionals develop sound working relationships (Bell, 2001; Hallett, 1995; Horwath and Calder, 1998; Murphy, 1995; Stevenson, 2005). When this takes place, professionals are more likely to have the confidence to contact social workers to discuss concerns about a child. As a Garda (police officer) in the study put it:Trust in the exchange of information is vital but takes time and continuity to build up.And a GP stated:I need to put a face to a name and strike up better liaison so there is room for informal discussion and to instil more confidence.One of the barriers to achieving effective working relationships, as indicated by the respondents, was high staff turnover within social work departments. This is as prevalent in the UK as it is in Ireland (Cm (5860), 2003; Jones, 2001). Respondents indicated that high staff turnover resulted in skilled, experienced workers leaving and being replaced by newly qualified and inexperienced staff whom they did not consider had the skill to manage highly complex referrals, which affected their willingness to discuss case details.Lack of accessOnly 29 per cent of the questionnaire respondents (n = 115) stated that they never had a problem contacting social workers, while 50 respondents (13 per cent)";Horwath - 2007 - The Missing Assessment Domain Personal, Professional and Organizational Factors Influencing Professional Judgements whe.pdf;Structure: Findings Results;1;;start=35 end=2561 startpage=10 endpage=10;Stefan Kleipoedszus;12/10/2018;Stefan Kleipoedszus;12/10/2018
37:226;onsidered lack of access was a barrier to referral. Those who shared the same building as social wor…;"onsidered lack of access was a barrier to referral. Those who shared the same building as social workers clearly had the easiest access and were most likely to dis- cuss their concerns with social workers. They found this particularly useful prior to making a referral, as they were able to discuss a situation and obtain advice before providing the actual name and details of a family. This approach is in line with the English What to do if... guidance (Department of Health et al., 2003). However, these respondents noted that accessibility could have negative consequences for children. For example, important information shared informally about families was often not recorded, meaning that professionals could potentially make different assumptions about the outcomes of these informal discussions.Professionals who were dependent on telephoning or writing to social workers to make a referral were less likely to have informal discussions about a case. These professionals described the frustrations of ‘poor availability and left messages not returned’. Lack of accessibility exacerbates problems of poor communication between professionals. In addition, lack of opportunity to hold discussions can lead to inappropriate decisions not to make a referral (Burton, 1996; Lagerberg, 2001).Perceptions of social work practiceSome of the decisions of professionals to refer cases were not based on the merits of the situation alone, but rather on the professionals’ perception of social work practice following referral. For example, 51 per cent of the GPs (n = 30) described how perceptions of the consequences for the child and fam- ily influenced their decision to refer. Doctors expressed reluctance to refer if they did not believe that a referral would lead to service provision or improve the situation for the family. This is commensurate with other findings (Burton, 1996; Haeringen et al., 1998; Polnay, 2000). Woodhouse and Pengelly (1991, p. 232) found that the anxiety generated by a particular type of problem resulted in members of the professional network referring cases to the agency ‘seen as specially competent and responsible in that area’. Professionals in the study, who did not perceive social work services to be competent in terms of providing the necessary services for the particular child, tended to monitor cases or refer to other professionals in the community. As a pre-school profes- sional said, ‘Referral to social workers is a last resort’.The respondents to the questionnaire held diverse views about social work practice—views which were likely to influence referral practice. For example, in response to a statement that social workers accept lower standards of parenting than other professionals who come into contact with children and families, 25 per cent (n = 97) agreed with the statement, 45 per cent (n = 175) disagreed and 28 per cent (n = 109) were unsure. They were also asked whether the criteria for accepting a referral depended on the judgement of the individ- ual social worker taking the referral. Forty-two per cent (n = 164) disagreed, whilst 34 per cent (n = 133) were unsure. In response to the question of";Horwath - 2007 - The Missing Assessment Domain Personal, Professional and Organizational Factors Influencing Professional Judgements whe.pdf;Structure: Findings Results;1;;start=18 end=3190 startpage=11 endpage=11;Stefan Kleipoedszus;12/10/2018;Stefan Kleipoedszus;12/10/2018
