Number;Name;Text Content;Document;Codes;Number of Codes;Comment;Location;Creator;Creation Date;Modifier;Modification Date
30:414;However, the stakes were high, as the case was in the court arena and the risks to the child signifi…;"However, the stakes were high, as the case was in the court arena and the risks to the child significant. Additionally, some of the issues were unfamiliar to the social worker. This might account for the attempted use of evidence-based practice (EBP) in the assessment record, such as:Babies need stimulation in order for cognitive development to be success- fully reached. When mothers suffer depression the babies’ cognitive devel- opment may be affected because there is less interaction between mother and baby. Depressed mothers are known to respond less frequently to their babies’ cries.In interview, the social worker suggested that there was also a need to provide clear evidence via the core assessment for the decisions being made:It just reaffirmed that the decision was correct. So you know it gave you extra evidence you know just to reaffirm what decisions were made were correct because the baby would have been at immediate risk.Thus, analytical decision making was used alongside experiential decision making in such a way as to provide evidence for decisions already taken intuitively.The impact of case characteristics and environmental factors on decision makingThe data therefore suggested that social workers rely primarily on experi- ential methods of decision making rather than more formal analytical methods. The next step was to investigate the way in which case, individual and environmental factors influenced these processes. It was striking that:† familiarity with the case was a feature of 70.4 per cent of cases, whilst his- torical information was available in 61.2 per cent of cases;† certainty was a feature in 70.4 per cent of cases; and† in 51.3 per cent of cases, decision making was seen to be straightforward.An initial exploration of the influence of these characteristics suggested that these factors were associated with the use of more intuitive cognition relying on prior case work experience. As one social worker described:It wasn’t a difficult conclusion to reach. I didn’t agonise over it. I felt that it was an easy decision to make as for what was the best outcome. . . . It’s not the first time I’ve had to make a recommendation on these lines (Case 14).This poses one set of challenges for achieving the kind of analytical decision making typically seen as the ‘gold standard’. An exploration of the decision environment within which participants were working raised a further set of challenges. This exploration was based on considering the presence or absence of nine factors considered typical of naturalistic decision environ- ments (Orasanu and Connolly, 1993; Lipshitz, 1993). Table 5 shows that";Hackett, Taylor - 2014 - Decision Making in Social Work with Children and Families The Use of Experiential and Analytical Cognitive Proc.pdf;Structure: Findings Results;1;;start=34 end=2702 startpage=10 endpage=10;Stefan Kleipoedszus;12/10/2018;Stefan Kleipoedszus;12/10/2018
30:415;elements of all of these nine factors (see Table 2 for explanations) were present in the cases under…;elements of all of these nine factors (see Table 2 for explanations) were present in the cases under examination.As can be seen in Table 5, the dynamic nature of the decision environ- ment was the prevalent complicating feature. Action/feedback loops (75.5 per cent), dynamic interplay (72 per cent) and uncertain dynamic environments (51 per cent) were the most frequently occurring factors to be found in the environment. This has implications for both decision making and the way in which analytical aids to decision making, such as the Assessment Framework, fit into this process, for two reasons.First, it shows that there was clearly interplay between the decision environment and the decision-making process. The process was therefore non-linear and social workers had to react and make decisions in the face of changing situations and changing levels of information so that decisions were never ‘discrete isolated events’ (Lipshitz, 1993, p. 133). As a result, in- formation was not always presented in a ‘neat, complete form’ (Orasanu and Connolly, 1993, p. 7) and, in fact, an ‘ill structured problem’ was a feature of 33.7 per cent of cases. This is in sharp contrast to the logical, step-by-step process suggested within conceptualisations of analytical decision making.Second, the non-linear nature of the decision-making process resulted in some decisions being made before the core assessment had been completed and consequently through means other than those proposed in assessment guidance. Therefore, the decision environment also seemed likely to have complicated the decision-making process so that decisions (of which 67 per cent were risk decisions) were being made using primarily experien- tial modes of decision making.Decision-making mechanismsUsing the findings from the analysis outlined in the preceding sections as a starting point, it was subsequently necessary to explore further the relation- ship between these individual, case and environmental factors and social workers’ cognitive processes using statistical methods in order to establish;Hackett, Taylor - 2014 - Decision Making in Social Work with Children and Families The Use of Experiential and Analytical Cognitive Proc.pdf;Structure: Findings Results;1;;start=400 end=2480 startpage=11 endpage=11;Stefan Kleipoedszus;12/10/2018;Stefan Kleipoedszus;12/10/2018
30:416;patterns of association across all cases. Since all of the cases involved some element of experienti…;patterns of association across all cases. Since all of the cases involved some element of experiential or intuitive decision making, it was most interesting to explore the mechanisms that were related to the use of analytical deci- sion making alongside these other cognitive processes.Initially, a basic exploration of the associations between analytical cogni- tion and each of the variables that emerged from the qualitative analysis as significant influences on the type of cognition used was undertaken using chi- square and ANOVA tests. Whilst the sample size was such that it was not possible to make inferences from these tests to the population as a whole, it was possible to use them to look at the emerging patterns in this data set. Where significant relationships were uncovered, Phi tests were then run to determine the strength and association of these relationships (Fielding and Gilbert, 2006, pp. 215–17). The resulting statistic provides a measure that ranges between –1 and 1, where zero means that there is no association and one means that there is a perfect association. Where a positive associ- ation exists (between 0 and 1), this means that, as one variable increases, so the other variable increases. Where a negative association exists (between 0 and – 1), this means that, as one variable increases, the other vari- able decreases. Table 6 shows the independent and outcome variables included in the Phi test and the strength and direction of these associations.The results shown in Table 6 show the following patterns of association existed in the data set:(1) As the level of perceived risk in a case increases, so analytical decision making increases.(2) As the social worker’s perceived level of certainty increases, analytical de- cision making decreases.(3) As familiarity with the type of case or issues raised increases, analytical decision making decreases.(4) As the amount of available historical information in a case increases, ana- lytical decision making increases.;Hackett, Taylor - 2014 - Decision Making in Social Work with Children and Families The Use of Experiential and Analytical Cognitive Proc.pdf;Structure: Findings Results;1;;start=34 end=2049 startpage=12 endpage=12;Stefan Kleipoedszus;12/10/2018;Stefan Kleipoedszus;12/10/2018
30:417;(5) As the perceived need for evidence, such as for legal proceedings, increases, analytical decisio…;(5) As the perceived need for evidence, such as for legal proceedings,increases, analytical decision making increases.(6) As dynamic interplay (i.e. the interplay between the decision environ- ment and social workers’ understanding of that environment) increases, analytical decision making increases.(7) As action/feedback loops (i.e. the extent to which action feeds back into further decision making) increases, analytical decision making increases.(8) As uncertain dynamic environment (e.g. uncertainty about how to proceed or a constantly changing situation) increases, analytical decision making increases.(9) As the stakes in a case increase, analytical decision making increases.The biggest influence on the use of analytical decision making was the pres- ence of high stakes, which showed a strong positive relationship with ana- lyitical decision making (phi value 1⁄4 0.600).Whilst this analysis provided some interesting initial indications about the relationships between case, individual and environmental characteristics and decision processes, these variables were rarely found in isolation. It was there- fore necessary to explore combinations of case and environmental characteris- tics and their relationship to the cognitive decision processes, in a way which could not be achieved through simple bivariate analysis. Cluster analysis was therefore used to identify how different combinations of case and environmen- tal factors co-occurred alongside different types of decision making according to the decision context. A QCA analysis was undertaken using the nine inde- pendent variables highlighted in Table 5, together with the outcome variable ‘analytical decision making’. The results of the QCA confirmed that, whilst de- cision making was predominantly experiential, there was variation in the type of decision-making strategy used according to complex combinations of case and environmental characteristics. Specifically, the results showed that the fol- lowing causal relationships existed between combinations of case and environ- mental characteristics and the use, or not, of analytical cognition:(1) Risk decision + historical information available + a need for evidence + an uncertain dynamic environment + action/feedback loops 1⁄4 presence of analytical cognition.(2) Case type familiar + absence of an uncertain dynamic environment + absence of action/feedback loops + absence of high stakes + absence of a need for evidence 1⁄4 absence of analytical cognition.;Hackett, Taylor - 2014 - Decision Making in Social Work with Children and Families The Use of Experiential and Analytical Cognitive Proc.pdf;Structure: Findings Results;1;;start=63 end=2570 startpage=13 endpage=13;Stefan Kleipoedszus;12/10/2018;Stefan Kleipoedszus;12/10/2018
33:226;Through iterative coding of the data from observa- tions, themes began to emerge, and the key findin…;Through iterative coding of the data from observa- tions, themes began to emerge, and the key findings could be grouped under themes as important factors in ‘sense-making activity’ in this office. To allow for sufficient depth of analysis and discussion within this paper, I have chosen to focus on two of the themes to emerge most strongly in the data collected:• Making sense through ‘framing’ the situation• Constructing responsibility.This research seeks to address the question ‘What are the methods by which social workers make sense of information in real-time practice situations?’ While these selected themes can be considered as distinct and separate phenomena in their own right, they are seen in this study to be complexly interrelated in practitioner’s sense-making activities. Considered together, they offer insight into the specific and situ- ated challenges of judgement in social work practice.MAKING SENSE THROUGH ‘FRAMING’ THE SITUATIONWorkers were observed to discuss cases with numer- ous people and in numerous ways across their working day. When workers were initiating the discussion with another person, they frequently started interactions with an opening statement.This opening statement or ‘frame’ appeared to act as an indicator or signifier for those elements of the dialogue which the initiator wished to emphasize as of greatest importance to their current understanding of the situation and to the current dialogue. This phenomenon was observed in both individual settings and in group settings.In the following extract, a standby social worker and a colleague discuss a case in a large shared office. The worker considered the breakdown of a child’s place- ment, with the primary focus on the emotional impact of their decision-making in this case.Joanne: ‘I feel so guilty for Kieran because I organised the placement. On the surface it was OK but I did have reserva- tions, I thought it would break down because of Kieran’s behaviour.’This frame of ‘my emotional responses’ guided col- leagues to a discussion which then helped the worker to make sense of both the feelings and past decision-making. By means of the initial frame, the interaction was steered, by mutual consent, to an important dis- cussion of the impact of this situation on the worker, which ultimately may have helped them contain these difficult feelings, explore the complex issues of causa- tion in the placement breakdown and integrate learn- ing from this experience into ongoing practice wisdom.Initial frames were not always accepted or agreed between those involved. In this next passage, the standby social worker (Jessica) has a discussion with the standby team leader (Catherine) about a message which was passed on to her by the receptionist. The standby worker provides a primary frame of ‘possible child protection’, but the team leader does not fully endorse this categorization.Jessica: ‘This is possible child protection. It’s a wee girl, Kelly Gardner, one of Pat’s (another social worker) clients.’ Catherine: (answers t/c from practice team manager) ‘2 pos- sible child protection ones . . . one of Pat’s, Kelly . . . I don’t know. Jessica says it’s child protection.’Jessica: ‘Kelly is saying very clearly that her dad assaulted her last night.’Catherine: (to Jessica) ‘What’s her age?’Jessica: ‘Seven’The team leader is focused on the subjectivity of the claim: ‘I don’t know. Jessica says it’s child protection’. The initial frame was resisted and the standby worker then offered two pieces of supplementary evidence to support their initial frame of ‘child protection’, namely the child’s ‘clear’ statement and the commis- sion of a physical assault by a parent. The social worker did not fixate on the alleged assault but offered information relating to the child’s presentation, needs and statement about her desired outcome. While ‘child protection’ was a key frame for sense-making here, the inclusion of the word ‘possible’ was crucial in signalling a level of doubt. A more rigorous and methodical consideration of the facts allowed the team leader to ascertain the nature and extent of any inju- ries, but ensured that the alleged assault did not become the sole focus of the inquiry to the detriment of the child’s wider holistic needs.The child was there- fore not lost as an individual in their own right.The following extract exemplifies the way in which emotional frames of reference can have influence on decision-making. Concern and anxiety are constant features of child welfare and protection work. Emo- tions are therefore signalled and understood within the particular social and cultural practices of the social work office. The practice team manager comes to the standby team leader’s office to discuss a kinship;Helm - 2016 - Sense-making in a social work office An ethnographic study of safeguarding judgements.pdf;Structure: Findings Results;1;;start=173 end=4952 startpage=3 endpage=3;Stefan Kleipoedszus;12/10/2018;Stefan Kleipoedszus;12/10/2018
33:228;In this study, a significant code emerging from the data was that of ‘constructing a response’. In t…;"In this study, a significant code emerging from the data was that of ‘constructing a response’. In the process of sense-making, it was noted that the workers made sense of the data in the context of their under- standing of their professional role and the wider role of their organization. These observations suggest that professionals make sense of information with refer- ence to their specific roles and responsibilities. The following extract is a statement from the practice team manager at an allocation meeting. The discussion focused on a risk assessment of a father who had threatened to kill his children. With the risk assess- ment at an early stage, opinion about the likelihood of harm was divided between medical practitioners and addictions services. The statement offers insight into the task of sense-making in relation to professional response.Sandy: ‘Someone needs to own this. It’s either nothing or it’s way up there.’The first sentence opened up the possibility that an agency other than social work might take primary responsibility, but, given the levels of risk to the chil- dren, would appear unlikely. The nature of ‘owner- ship’ in this sentence was ambiguous, potentially encompassing a frustration about other professionals’ accountability for their risk assessments as well as a concern that a lead agency is required to coordinate the multi-professional risk assessment. The second sentence reflected the need to make a professional response that was founded on an accurate risk assess- ment. There was potential for a false-positive predic- tion of risk (unnecessary intervention where risk is predicted but harm does not occur) and a false- negative prediction (low/no intervention because risk is not predicted but harm does occur). The dilemma of the professional task is pithily but darkly con- structed in this sentence as ‘damned if you do, damned if you don’t’.Some passages of sense-making led quite quickly and clearly to a threshold for action (Dalgleish 2000) where a decision was made without equivocation or ambiguity. As there are relatively few areas of social work practice which are unequivocal and free of ambi- guity, these episodes were of particular interest as they may provide insight into the methods used in rapid decision-making and when such circumscribed sense- making processes may or may not be appropriate. When the threshold for action is reached, the search for further evidence stops, and the participant reachesa ‘good enough’ level of confidence in their judgement to take some form of action.In the following extract, a standby social worker takes a telephone call from reception about a looked- after child attending a birthday party. Before taking the call, the social worker checked with her manager (at the door) and checked the electronic information system. The standby worker then asked the following set of questions:Anna: ‘Is there any condition attached?Safety warrant, yes?Is Liam (child) concerned about dad being there? Will the parents be there?What do you think, Jane?Do you trust that he wouldn’t leave?’Through these questions, the standby worker has ascertained the following:• That the child is subject of compulsory measures ofcare• The child’s views about his father’s possibleattendance• The carer’s views generally, and, in particular,about Liam’s capacity for decision-making.At this point, the standby worker decided that they had sufficient information to make a decision:Anna: ‘Sounds fine to me. His parents won’t be there; he’ll be supervised; there’s a plan in place and he gets to go to the party.’The standby worker has made sense of their respon- sibility towards Liam. He must be kept safe from harm, but he must also not be denied the opportu- nities afforded to children who are not looked after. The worker appeared to have taken responsibility for a quick and intuitive risk assessment of the situation rather than delay decision-making for the return of Liam’s allocated worker. The risk assessment was by no means extensive, and it was not possible for me to ascertain how much additional information the standby worker had been provided with. However, the worker was able to clearly summarize the risk- reducing factors and the benefits accruing from the risk judgement.In the following extract, a team leader phoned another professional about a mother alleged to have bitten her daughter. It was noted that, as this was an adoptive placement, the adoption worker was con- sulted rather than an initial referral discussion (IRD) being arranged. Many agencies in Scotland hold an IRD when child protection concerns need to be dis- cussed between members of agencies, including the National Health Service, police and Local Authority";Helm - 2016 - Sense-making in a social work office An ethnographic study of safeguarding judgements.pdf;Structure: Findings Results;1;;start=83 end=4846 startpage=5 endpage=5;Stefan Kleipoedszus;12/10/2018;Stefan Kleipoedszus;12/10/2018
37:220;The findings from the study highlighted that the outcome for the child and family in terms of the id…;"The findings from the study highlighted that the outcome for the child and family in terms of the identification and referral of possible neglect is influenced in part by the nature of the concern but also by a range of other factors, including professionals’:• interpretation of child neglect;• understanding of professional roles in relation to assessing and referring;• feelings and anxieties;• perceptions of social work services;• working context and culture.Each of these is discussed in detail below.Professional interpretation: what is child neglect?As with the English definition of ‘child neglect’, the emphasis in the Irish defi- nition is on a failure to meet the developmental needs of the child (Department";Horwath - 2007 - The Missing Assessment Domain Personal, Professional and Organizational Factors Influencing Professional Judgements whe.pdf;Structure: Findings Results;1;;start=1872 end=2600 startpage=5 endpage=5;Stefan Kleipoedszus;12/10/2018;Stefan Kleipoedszus;12/10/2018
